{
  "$schema": "../../contracts/json-schema/nbti-questionnaire.v2.schema.json",
  "schemaVersion": "2.0.0",
  "kind": "nbti.questionnaire",
  "id": "nbti-mvp",
  "version": "2",
  "contentDigest": "sha256:15d3aa51300d1e885f5d18ac635379f12eef93c951b92ff1d609eb6a5661b757",
  "locale": "zh-CN",
  "title": "NBTI 12 类型思维风格测试",
  "questionCount": 24,
  "safety": {
    "notDiagnosis": true,
    "notPersonalityAssessment": true,
    "notAbilityRating": true,
    "statement": "NBTI 是趣味性的思维风格表达，不是心理诊断、人格测评或能力评级；结果只描述你在这组复杂情境中的判断方式。"
  },
  "dimensions": [
    {
      "id": "cognitivePath",
      "label": "认知路径",
      "left": {
        "id": "construction",
        "label": "建构 C"
      },
      "right": {
        "id": "deconstruction",
        "label": "解构 D"
      },
      "explanation": "你更常先搭建整体系统，还是拆开问题并检查底层结构。"
    },
    {
      "id": "driveSource",
      "label": "驱动力源",
      "left": {
        "id": "intuition",
        "label": "直觉 N"
      },
      "right": {
        "id": "logic",
        "label": "逻辑 L"
      },
      "explanation": "你更常依据直觉与意象，还是依据逻辑、数据和可验证关系。"
    },
    {
      "id": "cognitiveTempo",
      "label": "认知节奏",
      "left": {
        "id": "agility",
        "label": "敏捷 A"
      },
      "right": {
        "id": "reflection",
        "label": "反思 R"
      },
      "explanation": "你更常快速行动换取反馈，还是先停下来推演与复盘。"
    },
    {
      "id": "valueOrientation",
      "label": "价值取向",
      "left": {
        "id": "humanism",
        "label": "人文 H"
      },
      "right": {
        "id": "pragmatism",
        "label": "实用 P"
      },
      "explanation": "你更常关注人的体验与意义，还是关注结果、效率和现实可行性。"
    }
  ],
  "questions": [
    {
      "id": "q01",
      "order": 1,
      "tag": "危机与破局",
      "title": "危机与破局",
      "prompt": "你投入全部身家的核心项目遭遇了行业政策突变，资金链即将断裂，只够维持最后一个月的运营。此时你首先会怎么做？",
      "options": [
        {
          "id": "q01-0",
          "label": "召集团队，重新描绘项目的终极愿景，用极具感染力的演讲稳住军心，相信只要信念在就能找到出路。",
          "action": "召集团队，重新描绘项目的终极愿景，用极具感染力的演讲稳住军心，相信只要信念在就能找到出路。",
          "weights": {
            "cognitivePath": -1,
            "driveSource": -1,
            "cognitiveTempo": 0,
            "valueOrientation": -1
          }
        },
        {
          "id": "q01-1",
          "label": "立刻关停所有边缘业务，把成本结构拆解到最细的颗粒度，将所有剩余资源砸向唯一能快速回血的单点。",
          "action": "立刻关停所有边缘业务，把成本结构拆解到最细的颗粒度，将所有剩余资源砸向唯一能快速回血的单点。",
          "weights": {
            "cognitivePath": 1,
            "driveSource": 1,
            "cognitiveTempo": 0,
            "valueOrientation": 1
          }
        },
        {
          "id": "q01-2",
          "label": "凭直觉判断哪几个核心客户或投资人最有可能施以援手，立刻买机票飞过去当面沟通，先拿到救命钱再说。",
          "action": "凭直觉判断哪几个核心客户或投资人最有可能施以援手，立刻买机票飞过去当面沟通，先拿到救命钱再说。",
          "weights": {
            "cognitivePath": 0,
            "driveSource": -1,
            "cognitiveTempo": -1,
            "valueOrientation": 1
          }
        },
        {
          "id": "q01-3",
          "label": "闭门不出，复盘整个商业模式的底层逻辑是否已经失效，如果逻辑不成立，宁愿果断清算也不再盲目挣扎。",
          "action": "闭门不出，复盘整个商业模式的底层逻辑是否已经失效，如果逻辑不成立，宁愿果断清算也不再盲目挣扎。",
          "weights": {
            "cognitivePath": 1,
            "driveSource": 1,
            "cognitiveTempo": 1,
            "valueOrientation": 0
          }
        }
      ]
    },
    {
      "id": "q02",
      "order": 2,
      "tag": "危机与破局",
      "title": "危机与破局",
      "prompt": "你的公司推出了一款革命性的产品，但市场反馈极其冷淡，销量惨淡。面对内部的质疑声，你的应对策略是：",
      "options": [
        {
          "id": "q02-0",
          "label": "坚信自己对用户潜在需求的直觉判断，顶住压力继续打磨产品细节，直到它完美符合你心中的标准。",
          "action": "坚信自己对用户潜在需求的直觉判断，顶住压力继续打磨产品细节，直到它完美符合你心中的标准。",
          "weights": {
            "cognitivePath": 0,
            "driveSource": -1,
            "cognitiveTempo": 1,
            "valueOrientation": 1
          }
        },
        {
          "id": "q02-1",
          "label": "迅速组织A/B测试，上线多个不同版本的营销方案，用最快的数据反馈来决定下一步的方向。",
          "action": "迅速组织A/B测试，上线多个不同版本的营销方案，用最快的数据反馈来决定下一步的方向。",
          "weights": {
            "cognitivePath": 1,
            "driveSource": 1,
            "cognitiveTempo": -1,
            "valueOrientation": 0
          }
        },
        {
          "id": "q02-2",
          "label": "重新审视产品在整个行业生态中的位置，思考是否需要拉拢更多合作伙伴，构建一个更庞大的利益共同体来推动。",
          "action": "重新审视产品在整个行业生态中的位置，思考是否需要拉拢更多合作伙伴，构建一个更庞大的利益共同体来推动。",
          "weights": {
            "cognitivePath": -1,
            "driveSource": 1,
            "cognitiveTempo": 1,
            "valueOrientation": 0
          }
        },
        {
          "id": "q02-3",
          "label": "亲自下场做客服，倾听那些少数喜欢该产品的用户的真实心声，理解它在情感层面为人们带来了什么价值。",
          "action": "亲自下场做客服，倾听那些少数喜欢该产品的用户的真实心声，理解它在情感层面为人们带来了什么价值。",
          "weights": {
            "cognitivePath": 0,
            "driveSource": -1,
            "cognitiveTempo": 1,
            "valueOrientation": -1
          }
        }
      ]
    },
    {
      "id": "q03",
      "order": 3,
      "tag": "危机与破局",
      "title": "危机与破局",
      "prompt": "你接手了一个内部关系错综复杂、效率极低的部门。新官上任，你的第一把火会烧向哪里？",
      "options": [
        {
          "id": "q03-0",
          "label": "引入一套严密的绩效考核和流程管理系统，用冰冷的数据和规则替代人为的判断和博弈。",
          "action": "引入一套严密的绩效考核和流程管理系统，用冰冷的数据和规则替代人为的判断和博弈。",
          "weights": {
            "cognitivePath": 1,
            "driveSource": 1,
            "cognitiveTempo": 0,
            "valueOrientation": 1
          }
        },
        {
          "id": "q03-1",
          "label": "寻找部门中那些真正有才华但被边缘化的人，激发他们的创造力，用一种打破常规的文化重塑团队。",
          "action": "寻找部门中那些真正有才华但被边缘化的人，激发他们的创造力，用一种打破常规的文化重塑团队。",
          "weights": {
            "cognitivePath": 0,
            "driveSource": -1,
            "cognitiveTempo": -1,
            "valueOrientation": -1
          }
        },
        {
          "id": "q03-2",
          "label": "花时间梳理部门历史和每个人的利益诉求，构建一个能平衡各方关系、让大家“协同共生”的新架构。",
          "action": "花时间梳理部门历史和每个人的利益诉求，构建一个能平衡各方关系、让大家“协同共生”的新架构。",
          "weights": {
            "cognitivePath": -1,
            "driveSource": 0,
            "cognitiveTempo": 1,
            "valueOrientation": -1
          }
        },
        {
          "id": "q03-3",
          "label": "直接挑出几个最明显阻碍效率的“毒瘤”环节或人员，以雷霆手段快速清除，树立威信。",
          "action": "直接挑出几个最明显阻碍效率的“毒瘤”环节或人员，以雷霆手段快速清除，树立威信。",
          "weights": {
            "cognitivePath": 1,
            "driveSource": 0,
            "cognitiveTempo": -1,
            "valueOrientation": 1
          }
        }
      ]
    },
    {
      "id": "q04",
      "order": 4,
      "tag": "危机与破局",
      "title": "危机与破局",
      "prompt": "在一个重要的商业谈判中，对方提出了一个看似合理但隐含苛刻条件的方案，要求你当场表态。你会：",
      "options": [
        {
          "id": "q04-0",
          "label": "凭借多年的江湖经验和对对方底线的直觉判断，当场抛出一个极具压迫感的反制方案，打乱对方的节奏。",
          "action": "凭借多年的江湖经验和对对方底线的直觉判断，当场抛出一个极具压迫感的反制方案，打乱对方的节奏。",
          "weights": {
            "cognitivePath": 0,
            "driveSource": -1,
            "cognitiveTempo": -1,
            "valueOrientation": 1
          }
        },
        {
          "id": "q04-1",
          "label": "礼貌地暂停会议，要求对方提供每一项条款背后的具体测算逻辑，逐条拆解其合理性。",
          "action": "礼貌地暂停会议，要求对方提供每一项条款背后的具体测算逻辑，逐条拆解其合理性。",
          "weights": {
            "cognitivePath": 1,
            "driveSource": 1,
            "cognitiveTempo": 1,
            "valueOrientation": 0
          }
        },
        {
          "id": "q04-2",
          "label": "绕开具体条款的争论，把话题拉回到双方合作的长期愿景和共同价值观上，试图在更高维度达成共识。",
          "action": "绕开具体条款的争论，把话题拉回到双方合作的长期愿景和共同价值观上，试图在更高维度达成共识。",
          "weights": {
            "cognitivePath": -1,
            "driveSource": -1,
            "cognitiveTempo": 0,
            "valueOrientation": -1
          }
        },
        {
          "id": "q04-3",
          "label": "快速计算出妥协的成本与收益，如果整体ROI划算，当场拍板成交，绝不为了细枝末节浪费时间。",
          "action": "快速计算出妥协的成本与收益，如果整体ROI划算，当场拍板成交，绝不为了细枝末节浪费时间。",
          "weights": {
            "cognitivePath": 0,
            "driveSource": 1,
            "cognitiveTempo": -1,
            "valueOrientation": 1
          }
        }
      ]
    },
    {
      "id": "q05",
      "order": 5,
      "tag": "危机与破局",
      "title": "危机与破局",
      "prompt": "你被任命为一个陷入舆论风波的公众事件的调查组长，面对铺天盖地的猜测和情绪化的指责，你的调查切入点是：",
      "options": [
        {
          "id": "q05-0",
          "label": "抛开所有道德评判，用最严密的逻辑链条和确凿的数据证据，还原事件最真实的物理过程。",
          "action": "抛开所有道德评判，用最严密的逻辑链条和确凿的数据证据，还原事件最真实的物理过程。",
          "weights": {
            "cognitivePath": 1,
            "driveSource": 1,
            "cognitiveTempo": 0,
            "valueOrientation": 1
          }
        },
        {
          "id": "q05-1",
          "label": "深入挖掘事件背后隐藏的社会结构问题和人性弱点，写出一份具有深刻批判性和反思价值的报告。",
          "action": "深入挖掘事件背后隐藏的社会结构问题和人性弱点，写出一份具有深刻批判性和反思价值的报告。",
          "weights": {
            "cognitivePath": 1,
            "driveSource": 0,
            "cognitiveTempo": 1,
            "valueOrientation": -1
          }
        },
        {
          "id": "q05-2",
          "label": "敏锐捕捉公众情绪的焦点，用一种极具同理心和共情力的方式发声，首先安抚受害者的创伤。",
          "action": "敏锐捕捉公众情绪的焦点，用一种极具同理心和共情力的方式发声，首先安抚受害者的创伤。",
          "weights": {
            "cognitivePath": 0,
            "driveSource": -1,
            "cognitiveTempo": -1,
            "valueOrientation": -1
          }
        },
        {
          "id": "q05-3",
          "label": "将事件置于更宏大的历史和文化背景下，探讨它对未来文明走向的启示，试图建立一种新的共识。",
          "action": "将事件置于更宏大的历史和文化背景下，探讨它对未来文明走向的启示，试图建立一种新的共识。",
          "weights": {
            "cognitivePath": -1,
            "driveSource": 1,
            "cognitiveTempo": 0,
            "valueOrientation": -1
          }
        }
      ]
    },
    {
      "id": "q06",
      "order": 6,
      "tag": "危机与破局",
      "title": "危机与破局",
      "prompt": "你正在构思一部可能耗时数年的重量级作品（如小说、电影或开源软件）。在动笔前，你最看重的是：",
      "options": [
        {
          "id": "q06-0",
          "label": "建立一个无懈可击的世界观设定或底层架构，确保所有细节都能在这个系统中自洽运转。",
          "action": "建立一个无懈可击的世界观设定或底层架构，确保所有细节都能在这个系统中自洽运转。",
          "weights": {
            "cognitivePath": -1,
            "driveSource": 1,
            "cognitiveTempo": 1,